{
  "schema_version": "1.1.0",
  "student_id": "S001",
  "case_id": "shuping-teaching-v1",
  "material_kind": "synthetic",
  "stage": "draft",
  "paragraphs": [
    {
      "paragraph_id": "P01",
      "text": "教学模拟报告片段。库水位下降必然导致孔压上升，故滑坡一定发生；这一断言需要核查。"
    },
    {
      "paragraph_id": "P02",
      "text": "假设滑体快速入水，需进一步核查涌浪传播路径、库岸暴露与航运受体。该情境不是已发生的树坪灾害事件。"
    }
  ],
  "raw_analysis": [
    {
      "artifact_id": "A01",
      "kind": "notes",
      "content": "模拟学习笔记：先区分库水位与坡内地下水响应，再检查有效应力、渗流和临水支撑条件。没有原始孔压记录，不能给出确定性方向。"
    }
  ],
  "evidence_cards": [
    {
      "card_id": "E01",
      "source_id": "ZOU2021",
      "locator": "5.3 Scenario 3; 6 Discussion",
      "excerpt_type": "paraphrase",
      "excerpt": "论文讨论库水位快速下降阶段的渗流作用及地下水响应条件。",
      "interpretation": "文献机理可作为核查方向，但不是本模拟报告具备实测孔压证据的证明。",
      "paragraph_ids": [
        "P01"
      ]
    }
  ],
  "previous_issue_ids": [],
  "revisions": [],
  "report_scope": "full_report",
  "assessed_dimensions": [
    "problem_identification",
    "evidence_extraction",
    "reasoning_chain",
    "hazard_chain",
    "uncertainty",
    "mitigation_match"
  ]
}
